{
  "@context": "http://qiicr.org/dcmqi/contexts/dcmqi.jsonld",
  "id": "https://raw.githubusercontent.com/qiicr/dcmqi/master/doc/schemas/sr-tid1500-schema.json#",
  "$schema": "http://json-schema.org/draft-04/schema#",
  "definitions": {

    "measurementModifier": {
      "type": "object",
      "properties": {
        "modifier": {
          "$ref": "https://raw.githubusercontent.com/qiicr/dcmqi/master/doc/schemas/common-schema.json#/definitions/codeSequence"
        },
        "modifierValue": {
          "$ref": "https://raw.githubusercontent.com/qiicr/dcmqi/master/doc/schemas/common-schema.json#/definitions/codeSequence"
        }
      }
    },

    "measurementNumProperty": {
      "type": "object",
      "properties": {
        "numProperty": {
          "$ref": "https://raw.githubusercontent.com/qiicr/dcmqi/master/doc/schemas/common-schema.json#/definitions/codeSequence"
        },
        "numPropertyValue": {
          "type": "string"
        },
        "numPropertyUnits": {
          "$ref": "https://raw.githubusercontent.com/qiicr/dcmqi/master/doc/schemas/common-schema.json#/definitions/codeSequence"
        }
      }
    },

    "measurementDerivationParameter": {
      "type": "object",
      "properties": {
        "derivationParameter": {
          "$ref": "https://raw.githubusercontent.com/qiicr/dcmqi/master/doc/schemas/common-schema.json#/definitions/codeSequence"
        },
        "derivationParameterValue": {
          "type": "string"
        },
        "derivationParameterUnits": {
          "$ref": "https://raw.githubusercontent.com/qiicr/dcmqi/master/doc/schemas/common-schema.json#/definitions/codeSequence"
        }
      }
    },

    "measurementItem": {
      "type": "object",
      "additionalProperties": false,
      "properties": {
        "value": {
          "$ref": "https://raw.githubusercontent.com/qiicr/dcmqi/master/doc/schemas/common-schema.json#/definitions/DS"
        },
        "quantity": {
          "$ref": "https://raw.githubusercontent.com/qiicr/dcmqi/master/doc/schemas/common-schema.json#/definitions/codeSequence"
        },
        "units": {
          "$ref": "https://raw.githubusercontent.com/qiicr/dcmqi/master/doc/schemas/common-schema.json#/definitions/codeSequence"
        },
        "derivationModifier": {
          "$ref": "https://raw.githubusercontent.com/qiicr/dcmqi/master/doc/schemas/common-schema.json#/definitions/codeSequence"
        },

        "measurementModifiers": {
          "type": "array",
          "minItems": 1,
          "items": {
            "$ref": "#/definitions/measurementModifier"
          }
        },

        "measurementDerivationParameters": {
          "type": "array",
          "minItems": 1,
          "items": {
            "$ref": "#/definitions/measurementDerivationParameter"
          }
        },

        "measurementNumProperties": {
          "type": "array",
          "minItems": 1,
          "items": {
            "$ref": "#/definitions/measurementNumProperty"
          }
        },

        "measurementPopulationDescription": {
          "type": "string"
        },

        "measurementAlgorithmIdentification": {
          "$ref": "https://raw.githubusercontent.com/qiicr/dcmqi/master/doc/schemas/sr-common-schema.json#/definitions/measurementAlgorithmIdentification"
        }
      }
    },
    "qualitativeEvaluationItem":{
      "type": "object",
      "additionalProperties": false,
      "properties": {
        "conceptCode": {
          "$ref": "https://raw.githubusercontent.com/qiicr/dcmqi/master/doc/schemas/common-schema.json#/definitions/codeSequence"
        },
        "conceptValue": {
          "oneOf": [
            { "$ref": "https://raw.githubusercontent.com/qiicr/dcmqi/master/doc/schemas/common-schema.json#/definitions/codeSequence" },
            { "type": "string" }
          ]
        }
      }
    },

    "MeasurementGroup": {
      "type": "object",
      "additionalProperties": false,
      "properties": {
        "TrackingIdentifier": {
          "$ref": "https://raw.githubusercontent.com/qiicr/dcmqi/master/doc/schemas/sr-common-schema.json#/definitions/TEXT"
        },
        "TrackingUniqueIdentifier": {
          "$ref": "https://raw.githubusercontent.com/qiicr/dcmqi/master/doc/schemas/sr-common-schema.json#/definitions/UIDREF"
        },
        "ReferencedSegment": {
          "type": "number"
        },
        "SourceSeriesForImageSegmentation": {
          "$ref": "https://raw.githubusercontent.com/qiicr/dcmqi/master/doc/schemas/sr-common-schema.json#/definitions/UIDREF"
        },
        "segmentationSOPInstanceUID": {
          "$ref": "https://raw.githubusercontent.com/qiicr/dcmqi/master/doc/schemas/sr-common-schema.json#/definitions/UIDREF"
        },
        "rwvmMapUsedForMeasurement": {
          "$ref": "https://raw.githubusercontent.com/qiicr/dcmqi/master/doc/schemas/sr-common-schema.json#/definitions/UIDREF"
        },
        "MeasurementMethod": {
          "$ref": "https://raw.githubusercontent.com/qiicr/dcmqi/master/doc/schemas/common-schema.json#/definitions/codeSequence"
        },
        "Finding": {
          "$ref": "https://raw.githubusercontent.com/qiicr/dcmqi/master/doc/schemas/common-schema.json#/definitions/codeSequence"
        },
        "FindingSite": {
          "$ref": "https://raw.githubusercontent.com/qiicr/dcmqi/master/doc/schemas/common-schema.json#/definitions/codeSequence"
        },
        "Laterality": {
          "$ref": "https://raw.githubusercontent.com/qiicr/dcmqi/master/doc/schemas/common-schema.json#/definitions/codeSequence"
        },
        "measurementAlgorithmIdentification": {
          "$ref": "https://raw.githubusercontent.com/qiicr/dcmqi/master/doc/schemas/sr-common-schema.json#/definitions/measurementAlgorithmIdentification"
        },
        "measurementItems": {
          "type": "array",
          "minItems": 1,
          "items": {
            "$ref": "#/definitions/measurementItem"
          }
        },
        "qualitativeEvaluations": {
          "type": "array",
          "minItems": 1,
          "items": {
            "$ref": "#/definitions/qualitativeEvaluationItem"
          }
        }
      }
    },
    "referencedImageFileNames": {
      "type": "array",
      "minItems": 1,
      "items": {
        "type": "string"
      }
    }
  },
  "additionalProperties": false,
  "properties": {
    "@schema": {"type" : "string"},
    "compositeContext": {
      "$ref": "https://raw.githubusercontent.com/qiicr/dcmqi/master/doc/schemas/common-schema.json#/definitions/dicomInstancesFileNameList"
    },
    "imageLibrary": {
      "$ref": "https://raw.githubusercontent.com/qiicr/dcmqi/master/doc/schemas/common-schema.json#/definitions/dicomInstancesFileNameList"
    },
    "observerContext": {
      "$ref": "https://raw.githubusercontent.com/qiicr/dcmqi/master/doc/schemas/sr-common-schema.json#/definitions/observerContext"
    },
    "activitySession": {
      "type": "string",
      "default": "1"
    },
    "timePoint": {
      "type": "string",
      "default": "1"
    },
    "measurementMethod": {
      "$ref": "https://raw.githubusercontent.com/qiicr/dcmqi/master/doc/schemas/common-schema.json#/definitions/codeSequence"
    },
    "procedureReported": {
      "$ref": "https://raw.githubusercontent.com/qiicr/dcmqi/master/doc/schemas/common-schema.json#/definitions/codeSequence"
    },
    "VerificationFlag": {
      "allOf": [
        {
          "$ref": "https://raw.githubusercontent.com/qiicr/dcmqi/master/doc/schemas/common-schema.json#/definitions/CS"
        },
        {
          "enum": [
            "VERIFIED",
            "UNVERIFIED"
          ]
        },
        {
          "default": "UNVERIFIED"
        }
      ]
    },
    "CompletionFlag": {
      "allOf": [
        {
          "$ref": "https://raw.githubusercontent.com/qiicr/dcmqi/master/doc/schemas/common-schema.json#/definitions/CS"
        },
        {
          "enum": [
            "PARTIAL",
            "COMPLETE"
          ]
        },
        {
          "default": "PARTIAL"
        }
      ]
    },
    "SeriesDescription": {
      "$ref": "https://raw.githubusercontent.com/qiicr/dcmqi/master/doc/schemas/common-schema.json#/definitions/LO",
      "default": "Measurements"
    },
    "SeriesNumber": {
      "$ref": "https://raw.githubusercontent.com/qiicr/dcmqi/master/doc/schemas/common-schema.json#/definitions/IS",
      "default": "400"
    },
    "InstanceNumber": {
      "$ref": "https://raw.githubusercontent.com/qiicr/dcmqi/master/doc/schemas/common-schema.json#/definitions/IS",
      "default": "1"
    },
    "Measurements": {
      "type": "array",
      "minItems": 1,
      "items": {
        "$ref": "#/definitions/MeasurementGroup"
      }
    }
  }
}
